noreply@github.com,"Hey hritik-h! A sign in attempt requires further verification because we did not recognize your device. To complete the sign in, enter the verification code on the unrecognized device. Device: Chrome"
noreply@us-news.alison.com,Check out the latest and trending courses for the week and progress your learner journey with this weekly course catalogue. View in web browser Share on social Share on Facebook Share on Twitter Share
info@send.grammarly.com,"New tone, new records – see your stats now! FEBRUARY 07 - FEBRUARY 14 Your Weekly Writing Update Watch out – Grammarly VIP coming through! Not only did you unlock a new tone last week, but you also set"
support@codepen.io,"This is a special edition of the CodePen Spark sponsored exclusively by DataStax Astra, a cloud-native Database-as-a-Service. If you&#39;d prefer not to receive the CodePen Spark, you can opt out."
no-reply@geeksforgeeks.org,"Be a part of something great, with GeeksforGeeks Premium! Hey Geek, Choose Knowledge. Choose Inspiration. Choose Success. Choose GeeksforGeeks Premium. Why Go Premium? So that you can get access to: Ad"
howtousethebrain-space@quora.com,"1 - “So last night I was positive there was a ghost baby in the bed with my Space Cover Photo How To Use The Brain · 534k followers Psychology, Motivation, Self-help, Thinking, &amp; Learning (Science"
updates@myntra.com,"Get the latest on all things sneakers. To unsubscribe from these mailings, you may opt out here. If you would like to experience the best of online shopping for men, women and kids in India, you are at"
jobmessenger@monsterindia.com,"Dear Hritik Kumar Singh Apply to these top jobs recommended for you Senior Developer ********** Madurai | 3-4 yrs Skills: Software Developer, Senior Developer APPLY Senior K2 Cloud Developer Verzeo"
recruitment@fresherism.com,"Dear Hritik, Greetings ! We are glad to inform that we have now resumed our services fully fledged and while hiring for our company as well as our clientele, we collectively need a huge number of"
onlinecourses@nptel.iitm.ac.in,Dear students The lecture videos for Week-5 have been uploaded for the course Introduction to Machine Learning . The lectures can be accessed using the following link: https://onlinecourses.nptel.ac.in
no-reply@mail.instagram.com,"Gaming Fectum and 1 other want to follow you. Gaming Fectum Suggested for you View Profile nata.ndmarc Suggested for you View Profile Open Instagram © Instagram. Facebook Inc., 1601 Willow Road, Menlo"
no-reply+9e5b2199@classroom.google.com,"Hi Hritik, kinshuk banerjee posted a new announcement in Compiler5thSem B2. Join The Class Meeting ID: 328 286 6011 Passcode: cseSEM5b2 OPEN If you don&#39;t want to receive emails from Classroom, you"
no-reply+fdf0897a@classroom.google.com,"Hi Hritik, Samiran Gupta posted a new announcement in Operating System PCCCS 592 B1 B1. In lab Write the assignment as per instruction.......may I give the nxt part Wednesday and ask to complete it by"
notifications@instructure.com,Date: 19th Feb. 2021 Time: 1:00 PM Go the Conference and Join with MIC mode View announcement | Update your notification settings
notifications@instructure.com,Date: 20th Feb. 2021 Time: 1:00 PM Go the Conference and Join with MIC mode View announcement | Update your notification settings
notifications@instructure.com,Date: 18th Feb. 2021 Time: 1:00 PM Go the Conference and Join with MIC mode View announcement | Update your notification settings
mail@info.paytmmoney.com,Apply for IPO for FREE*. Nureca Ltd. IPO is Now Live Issue Period 15 th Feb to 17 th Feb 2021 Price Band ₹ 396-400 Lot Size 35 shares Strengths Strong portfolio of products Consistent focus on quality
udemy@email.udemy.com,Learn on your schedule with bite-sized content. We make learning something you&#39;ll love to do. My Courses | Featured Valentine&#39;s Sale ends today Crush on these trending courses for as little as
info@kopykitab.com,"Kopykitab.com Dear , Indian Engineering Services (IES) exam, also known as Engineering Services Examination (ESE), is a national level recruitment exam organised by the Union Public Service Commission"
noreply@medium.com,Stories for Hritik Bnp. From text to knowledge. The information extraction pipeline. Fake News Detection using NLP techniques. TLDR: Writing a Slack bot to Summarize Articles. Stories for Hritik Bnp
Codeforces@codeforces.com,"Hello, hritik.bnp. Welcome to Educational Codeforces Round. The round will be rated for ratings up to 2100. You are welcome to register and compete in Educational Codeforces Round 104. It starts on"
info@mailer.netflix.com,Hate adverts? So do we. Netflix has no ads...ever. ‌ ‌ ‌ ‌ ‌ ‌ ‌ ‌ ‌ ‌ ‌ ‌ ‌ ‌ ‌ ‌ ‌ ‌ ‌ ‌ ‌ ‌ ‌ ‌ ‌ ‌ ‌ ‌ ‌ ‌ ‌ ‌ ‌ ‌ ‌ ‌ ‌ ‌ ‌ ‌ ‌ ‌ ‌ ‌ ‌ ‌ ‌ ‌ ‌ ‌ ‌ ‌ ‌ ‌ ‌ ‌ ‌ ‌ ‌ ‌ ‌ ‌ ‌ ‌ ‌ ‌ ‌ ‌ ‌ ‌ ‌ ‌ ‌ ‌ ‌
no-reply@ncb.flipkart.com,Make them yours... Gift Voucher House of Flipkart MarQ Kitchen Appliances Home &amp; Office Furniture Men&#39;s Fashion Women&#39;s Fashion Sports &amp; Fitness Range Sports &amp; Fitness Range
